{
  "contract_version": "feedback-signal/v1",
  "feedback_id": "feedback:interaction-001:002",
  "kind": "explicit_request",
  "observed_at": "2026-08-11T20:41:00+09:00",
  "source": {
    "interaction_id": "interaction:001",
    "event_id": "interaction:001:outcome:001",
    "artifact_refs": ["artifact:interaction-001:001"]
  },
  "summary_code": "request:add-art-evidence",
  "evidence_refs": ["interaction:001:outcome:001"],
  "confidence": {"level": "explicit", "score": 1.0},
  "hypothesis": null,
  "target": {
    "owner_repository": "art-history",
    "routing_status": "confirmed"
  },
  "consent": {
    "scope": "interaction-improvement",
    "issue_creation_permitted": true,
    "profile_update_permitted": false
  },
  "promoted_to_user_fact": false
}
